# Pathway	MSM5LLHA_P_Abundance
UNMAPPED	2617453.2422464653
UNINTEGRATED	1352629.9155433308
UNINTEGRATED|g__Prevotella.s__Prevotella_copri	1143641.0843141205
UNINTEGRATED|g__Bacteroides.s__Bacteroides_caccae	445062.3266492042
UNINTEGRATED|g__Bacteroides.s__Bacteroides_uniformis	186483.2886443569
UNINTEGRATED|g__Faecalibacterium.s__Faecalibacterium_prausnitzii	150612.4175503197
UNINTEGRATED|g__Bacteroides.s__Bacteroides_vulgatus	134431.5393336594
UNINTEGRATED|g__Bacteroides.s__Bacteroides_ovatus	68990.6071220274
UNINTEGRATED|g__Bacteroides.s__Bacteroides_xylanisolvens	55965.0272019117
UNINTEGRATED|g__Blautia.s__Ruminococcus_obeum	55329.2502113330
UNINTEGRATED|g__Parabacteroides.s__Parabacteroides_distasonis	53429.7863912264
UNINTEGRATED|g__Blautia.s__Ruminococcus_torques	30966.9503606873
UNINTEGRATED|g__Eubacterium.s__Eubacterium_ventriosum	26950.6995886240
UNINTEGRATED|g__Odoribacter.s__Odoribacter_splanchnicus	15286.8037397682
UNINTEGRATED|g__Bacteroides.s__Bacteroides_stercoris	13884.0938623611
UNINTEGRATED|g__Bacteroides.s__Bacteroides_thetaiotaomicron	13085.5246679063
UNINTEGRATED|g__Akkermansia.s__Akkermansia_muciniphila	988.1900163083
PWY-7219: adenosine ribonucleotides de novo biosynthesis	6716.4930366791
PWY-7219: adenosine ribonucleotides de novo biosynthesis|g__Prevotella.s__Prevotella_copri	5335.2121889772
PWY-7219: adenosine ribonucleotides de novo biosynthesis|g__Bacteroides.s__Bacteroides_vulgatus	295.6836494139
PWY-7219: adenosine ribonucleotides de novo biosynthesis|g__Faecalibacterium.s__Faecalibacterium_prausnitzii	176.2569406562
PWY-7219: adenosine ribonucleotides de novo biosynthesis|g__Bacteroides.s__Bacteroides_caccae	85.8630652629
PWY-7219: adenosine ribonucleotides de novo biosynthesis|g__Parabacteroides.s__Parabacteroides_distasonis	53.0007707094
PWY-7219: adenosine ribonucleotides de novo biosynthesis|g__Bacteroides.s__Bacteroides_thetaiotaomicron	50.4652844946
PWY-7219: adenosine ribonucleotides de novo biosynthesis|g__Odoribacter.s__Odoribacter_splanchnicus	40.0805606657
PWY-7219: adenosine ribonucleotides de novo biosynthesis|g__Eubacterium.s__Eubacterium_ventriosum	23.6557995879
PWY-7219: adenosine ribonucleotides de novo biosynthesis|g__Blautia.s__Ruminococcus_torques	16.3863401795
PWY-7219: adenosine ribonucleotides de novo biosynthesis|g__Bacteroides.s__Bacteroides_stercoris	14.4577143793
PWY-7219: adenosine ribonucleotides de novo biosynthesis|g__Bacteroides.s__Bacteroides_uniformis	14.2036226310
PWY-7221: guanosine ribonucleotides de novo biosynthesis	2784.1501307148
PWY-2942: L-lysine biosynthesis III	2174.5869843908
PWY-2942: L-lysine biosynthesis III|g__Prevotella.s__Prevotella_copri	1729.9929696670
PWY-5097: L-lysine biosynthesis VI	1741.0529373874
PWY-5097: L-lysine biosynthesis VI|g__Prevotella.s__Prevotella_copri	1023.2180847174
PWY-1042: glycolysis IV (plant cytosol)	1416.9198070245
PWY-1042: glycolysis IV (plant cytosol)|g__Bacteroides.s__Bacteroides_caccae	46.1483985109
PEPTIDOGLYCANSYN-PWY: peptidoglycan biosynthesis I (meso-diaminopimelate containing)	767.9460955792
NONMEVIPP-PWY: methylerythritol phosphate pathway I	650.3361910765
PWY-6387: UDP-N-acetylmuramoyl-pentapeptide biosynthesis I (meso-diaminopimelate containing)	648.7000413438
PWY-6387: UDP-N-acetylmuramoyl-pentapeptide biosynthesis I (meso-diaminopimelate containing)|g__Faecalibacterium.s__Faecalibacterium_prausnitzii	42.1720907527
NONOXIPENT-PWY: pentose phosphate pathway (non-oxidative branch)	618.3293416210
NONOXIPENT-PWY: pentose phosphate pathway (non-oxidative branch)|g__Bacteroides.s__Bacteroides_thetaiotaomicron	21.8109251449
NONOXIPENT-PWY: pentose phosphate pathway (non-oxidative branch)|g__Odoribacter.s__Odoribacter_splanchnicus	21.2991122536
GLUCUROCAT-PWY: superpathway of &beta;-D-glucuronide and D-glucuronate degradation	542.4257839139
PWY-7242: D-fructuronate degradation	504.4150882386
PWY-7242: D-fructuronate degradation|g__Faecalibacterium.s__Faecalibacterium_prausnitzii	450.0069665084
PWY-6737: starch degradation V	461.7942687409
PWY-6737: starch degradation V|g__Faecalibacterium.s__Faecalibacterium_prausnitzii	146.2262788598
ILEUSYN-PWY: L-isoleucine biosynthesis I (from threonine)	420.4025241256
ILEUSYN-PWY: L-isoleucine biosynthesis I (from threonine)|g__Faecalibacterium.s__Faecalibacterium_prausnitzii	47.9319190498
ILEUSYN-PWY: L-isoleucine biosynthesis I (from threonine)|g__Blautia.s__Ruminococcus_obeum	13.4710590449
ILEUSYN-PWY: L-isoleucine biosynthesis I (from threonine)|g__Akkermansia.s__Akkermansia_muciniphila	3.6374763481
VALSYN-PWY: L-valine biosynthesis	420.4025241256
VALSYN-PWY: L-valine biosynthesis|g__Faecalibacterium.s__Faecalibacterium_prausnitzii	47.9319190498
VALSYN-PWY: L-valine biosynthesis|g__Blautia.s__Ruminococcus_obeum	13.4710590449
VALSYN-PWY: L-valine biosynthesis|g__Akkermansia.s__Akkermansia_muciniphila	3.6374763481
ANAGLYCOLYSIS-PWY: glycolysis III (from glucose)	413.5118032443
PWY-7229: superpathway of adenosine nucleotides de novo biosynthesis I	393.2853297855
PWY-3841: folate transformations II	386.3852840637
PWY-3841: folate transformations II|g__Bacteroides.s__Bacteroides_vulgatus	181.1268792401
PWY-3841: folate transformations II|g__Parabacteroides.s__Parabacteroides_distasonis	39.4203856738
PWY-3841: folate transformations II|g__Bacteroides.s__Bacteroides_caccae	32.8125152034
BRANCHED-CHAIN-AA-SYN-PWY: superpathway of branched amino acid biosynthesis	370.0716128584
BRANCHED-CHAIN-AA-SYN-PWY: superpathway of branched amino acid biosynthesis|g__Faecalibacterium.s__Faecalibacterium_prausnitzii	23.9610463471
PWY-5686: UMP biosynthesis	346.9009493774
PWY-7228: superpathway of guanosine nucleotides de novo biosynthesis I	326.1386072032
PWY0-162: superpathway of pyrimidine ribonucleotides de novo biosynthesis	315.7653078394
RHAMCAT-PWY: L-rhamnose degradation I	310.5247553517
RHAMCAT-PWY: L-rhamnose degradation I|g__Bacteroides.s__Bacteroides_ovatus	87.5735861712
RHAMCAT-PWY: L-rhamnose degradation I|g__Bacteroides.s__Bacteroides_thetaiotaomicron	42.8702156996
GALACT-GLUCUROCAT-PWY: superpathway of hexuronide and hexuronate degradation	271.4595822589
DTDPRHAMSYN-PWY: dTDP-L-rhamnose biosynthesis I	261.1815351260
DTDPRHAMSYN-PWY: dTDP-L-rhamnose biosynthesis I|g__Faecalibacterium.s__Faecalibacterium_prausnitzii	29.3021579217
DTDPRHAMSYN-PWY: dTDP-L-rhamnose biosynthesis I|g__Bacteroides.s__Bacteroides_xylanisolvens	29.1877886455
ARGININE-SYN4-PWY: L-ornithine de novo  biosynthesis	247.1723821176
PWY-7208: superpathway of pyrimidine nucleobases salvage	244.6585338844
PANTOSYN-PWY: pantothenate and coenzyme A biosynthesis I	235.6631852000
PWY-6385: peptidoglycan biosynthesis III (mycobacteria)	234.7089392808
PWY-7111: pyruvate fermentation to isobutanol (engineered)	231.5435677666
PWY-7111: pyruvate fermentation to isobutanol (engineered)|g__Faecalibacterium.s__Faecalibacterium_prausnitzii	56.1296848677
PWY-6126: superpathway of adenosine nucleotides de novo biosynthesis II	224.4460331451
CALVIN-PWY: Calvin-Benson-Bassham cycle	220.9622276859
CALVIN-PWY: Calvin-Benson-Bassham cycle|g__Faecalibacterium.s__Faecalibacterium_prausnitzii	14.7540149134
PWY-6125: superpathway of guanosine nucleotides de novo biosynthesis II	218.5515736697
PWY-724: superpathway of L-lysine, L-threonine and L-methionine biosynthesis II	218.4290212410
PANTO-PWY: phosphopantothenate biosynthesis I	215.3612090013
PYRIDNUCSYN-PWY: NAD biosynthesis I (from aspartate)	212.5352736983
PYRIDNUCSYN-PWY: NAD biosynthesis I (from aspartate)|g__Odoribacter.s__Odoribacter_splanchnicus	17.9639825167
COA-PWY: coenzyme A biosynthesis I	204.9243459001
COA-PWY: coenzyme A biosynthesis I|g__Faecalibacterium.s__Faecalibacterium_prausnitzii	21.7630479794
1CMET2-PWY: N10-formyl-tetrahydrofolate biosynthesis	186.3652768987
GALACTUROCAT-PWY: D-galacturonate degradation I	183.9344520587
GALACTUROCAT-PWY: D-galacturonate degradation I|g__Faecalibacterium.s__Faecalibacterium_prausnitzii	113.3565603211
PWY-6163: chorismate biosynthesis from 3-dehydroquinate	179.8425940298
FASYN-ELONG-PWY: fatty acid elongation -- saturated	175.7193505647
PWY-7663: gondoate biosynthesis (anaerobic)	175.7193505647
GLYCOLYSIS: glycolysis I (from glucose 6-phosphate)	171.4913248901
PWY-3001: superpathway of L-isoleucine biosynthesis I	170.2346120709
PWY-3001: superpathway of L-isoleucine biosynthesis I|g__Faecalibacterium.s__Faecalibacterium_prausnitzii	33.4997890392
PWY-5484: glycolysis II (from fructose 6-phosphate)	167.7459360121
COA-PWY-1: coenzyme A biosynthesis II (mammalian)	167.3395109869
COA-PWY-1: coenzyme A biosynthesis II (mammalian)|g__Faecalibacterium.s__Faecalibacterium_prausnitzii	25.0631167000
PWYG-321: mycolate biosynthesis	161.1209031792
CITRULBIO-PWY: L-citrulline biosynthesis	153.5698280568
PWY-4981: L-proline biosynthesis II (from arginine)	139.3404910930
COMPLETE-ARO-PWY: superpathway of aromatic amino acid biosynthesis	132.4579683688
HISTSYN-PWY: L-histidine biosynthesis	126.2491303245
ANAEROFRUCAT-PWY: homolactic fermentation	124.8922335160
THRESYN-PWY: superpathway of L-threonine biosynthesis	121.8824255211
THRESYN-PWY: superpathway of L-threonine biosynthesis|g__Faecalibacterium.s__Faecalibacterium_prausnitzii	27.8994964102
ARO-PWY: chorismate biosynthesis I	118.5759773626
PWY-7220: adenosine deoxyribonucleotides de novo biosynthesis II	98.0637343171
PWY-7222: guanosine deoxyribonucleotides de novo biosynthesis II	98.0637343171
PWY0-1296: purine ribonucleosides degradation	77.7520201357
PWY-6609: adenine and adenosine salvage III	77.5541453778
PWY-6609: adenine and adenosine salvage III|g__Blautia.s__Ruminococcus_torques	22.4232822699
PWY-7199: pyrimidine deoxyribonucleosides salvage	75.3640582725
PWY-3781: aerobic respiration I (cytochrome c)	74.1361886266
PWY0-1297: superpathway of purine deoxyribonucleosides degradation	65.9900271297
P162-PWY: L-glutamate degradation V (via hydroxyglutarate)	64.2004088780
PWY-1861: formaldehyde assimilation II (RuMP Cycle)	63.4825025649
PWY-621: sucrose degradation III (sucrose invertase)	61.6844746306
PWY-621: sucrose degradation III (sucrose invertase)|g__Faecalibacterium.s__Faecalibacterium_prausnitzii	29.5620219277
PWY-5659: GDP-mannose biosynthesis	52.4026998377
PWY0-1586: peptidoglycan maturation (meso-diaminopimelate containing)	45.5502576613
PWY0-1586: peptidoglycan maturation (meso-diaminopimelate containing)|g__Odoribacter.s__Odoribacter_splanchnicus	9.0440504553
PWY-6317: galactose degradation I (Leloir pathway)	41.2673271582
PWY66-422: D-galactose degradation V (Leloir pathway)	41.2673271582
PWY-6121: 5-aminoimidazole ribonucleotide biosynthesis I	39.3474917446
PWY-6527: stachyose degradation	37.7546732154
PWY-6305: putrescine biosynthesis IV	33.7402806838
PWY-6305: putrescine biosynthesis IV|g__Odoribacter.s__Odoribacter_splanchnicus	25.5408768108
PWY-6122: 5-aminoimidazole ribonucleotide biosynthesis II	32.4113730671
PWY-6277: superpathway of 5-aminoimidazole ribonucleotide biosynthesis	32.4113730671
THISYNARA-PWY: superpathway of thiamin diphosphate biosynthesis III (eukaryotes)	28.5557266838
PWY66-399: gluconeogenesis III	22.4831887852
PWY-6151: S-adenosyl-L-methionine cycle I	19.2612924623
ASPASN-PWY: superpathway of L-aspartate and L-asparagine biosynthesis	4.1141013674